{
  "specVersion": "1.0.0",
  "packId": "DP-2026-001",
  "createdAt": "2026-10-06T18:00:00Z",
  "generator": {
    "name": "ExampleGenerator",
    "version": "1.0.0",
    "url": "https://example.com/example-generator"
  },
  "conformanceLevel": "DeliveryPack.Core",
  "integrity": {
    "algorithm": "sha256",
    "hash": "a1b2c3d4e5f60718293a4b5c6d7e8f90a1b2c3d4e5f60718293a4b5c6d7e8f90"
  },
  "capabilities": ["architecture-viewer"],
  "tasks": [],
  "sections": [
    { "section": "00-manifest", "files": ["MANIFEST.md", "manifest.json"] },
    { "section": "01-baseline", "files": ["baseline-pin.md"] },
    { "section": "02-context", "files": ["context-summary.md", "requirements.md"] },
    { "section": "03-architecture", "files": ["architecture-summary.md"] }
  ]
}
